PVD,"Providence, RI: Rhode Island Tf Green International",16811.0,3576.0,342.14,0.2127178633037892,2003.4
PVU,"Provo, UT: Provo Municipal",2188.0,567.0,141.5,0.25914076782449724,2003.4
PWM,"Portland, ME: Portland International Jetport",12687.0,2478.0,418.28,0.1953180420903287,2003.4
RAP,"Rapid City, SD: Rapid City Regional",5341.0,966.0,465.38,0.18086500655307994,2003.4
RDD,"Redding, CA: Redding Regional",1544.0,255.0,461.87,0.16515544041450778,2003.4
RDM,"Bend/Redmond, OR: Roberts Field",7786.0,1310.0,456.47,0.16825070639609555,2003.4
RDU,"Raleigh/Durham, NC: Raleigh-Durham International",62240.0,13670.0,364.02,0.219633676092545,2003.4
RFD,"Rockford, IL: Chicago/Rockford International",840.0,121.0,170.8,0.14404761904761904,2003.4
RHI,"Rhinelander, WI: Rhinelander/Oneida County",827.0,167.0,721.09,0.20193470374848851,2003.4
RIC,"Richmond, VA: Richmond International",23873.0,5168.0,407.1,0.21647886733967242,2003.4
RIW,"Riverton/Lander, WY: Central Wyoming Regional",622.0,94.0,594.08,0.15112540192926044,2003.4
RKS,"Rock Springs, WY: Southwest Wyoming Regional",623.0,94.0,573.51,0.1508828250401284,2003.4
RNO,"Reno, NV: Reno/Tahoe International",22137.0,4374.0,388.44,0.19758774901748205,2003.4
ROA,"Roanoke, VA: Roanoke Blacksburg Regional",6975.0,1410.0,519.68,0.2021505376344086,2003.4
ROC,"Rochester, NY: Frederick Douglass Grtr Rochester International",15354.0,3064.0,386.48,0.19955711866614562,2003.4
ROW,"Roswell, NM: Roswell Air Center",963.0,182.0,549.95,0.18899273104880582,2003.4
RST,"Rochester, MN: Rochester International",2186.0,487.0,504.91,0.22278133577310155,2003.4
RSW,"Fort Myers, FL: Southwest Florida International",34878.0,7926.0,343.86,0.22724926888009633,2003.4
SAF,"Santa Fe, NM: Santa Fe Municipal",3367.0,679.0,544.59,0.20166320166320167,2003.4
SAN,"San Diego, CA: San Diego International",95699.0,22840.0,373.79,0.23866498082529597,2003.4
SAT,"San Antonio, TX: San Antonio International",42474.0,9804.0,398.9,0.23082356265009182,2003.4
SAV,"Savannah, GA: Savannah/Hilton Head International",21074.0,4321.0,399.56,0.20503938502420044,2003.4
SBA,"Santa Barbara, CA: Santa Barbara Municipal",7909.0,1445.0,454.5,0.1827032494626375,2003.4
SBN,"South Bend, IN: South Bend International",6690.0,1558.0,413.1,0.2328849028400598,2003.4
SBP,"San Luis Obispo, CA: San Luis County Regional",5516.0,1058.0,530.2,0.19180565627266136,2003.4
SBY,"Salisbury, MD: Salisbury-Ocean City/Wicomico Regional",1831.0,264.0,690.53,0.1441835062807209,2003.4
SCC,"Deadhorse, AK: Deadhorse Airport",570.0,65.0,531.62,0.11403508771929824,2003.4
SCE,"State College, PA: University Park",3084.0,535.0,634.61,0.17347600518806744,2003.4
SCK,"Stockton, CA: Stockton Metro",515.0,112.0,127.51,0.2174757281553398,2003.4
SDF,"Louisville, KY: Louisville Muhammad Ali International",26698.0,5454.0,389.45,0.20428496516593003,2003.4
SEA,"Seattle, WA: Seattle/Tacoma International",184912.0,35033.0,396.6,0.18945768798131002,2003.4
SFB,"Sanford, FL: Orlando Sanford International",9501.0,2537.0,123.12,0.26702452373434377,2003.4
SFO,"San Francisco, CA: San Francisco International",136912.0,40386.0,452.89,0.29497779595652684,2003.4
SGF,"Springfield, MO: Springfield-Branson National",10657.0,2313.0,456.23,0.2170404429013794,2003.4
SGU,"St. George, UT: St George Regional",3023.0,415.0,582.51,0.13728084684088654,2003.4
SHR,"Sheridan, WY: Sheridan County",730.0,108.0,685.84,0.14794520547945206,2003.4
SHV,"Shreveport, LA: Shreveport Regional",5953.0,1067.0,516.94,0.17923735931463128,2003.4
SIT,"Sitka, AK: Sitka Rocky Gutierrez",1421.0,310.0,462.11,0.21815622800844475,2003.4
SJC,"San Jose, CA: Norman Y. Mineta San Jose International",51225.0,9135.0,336.26,0.17833089311859443,2003.4
SJT,"San Angelo, TX: San Angelo Regional/Mathis Field",1089.0,210.0,749.89,0.1928374655647383,2003.4
SJU,"San Juan, PR: Luis Munoz Marin International",35435.0,9251.0,277.9,0.261069563990405,2003.4
SLC,"Salt Lake City, UT: Salt Lake City International",113486.0,17352.0,434.26,0.15289991717039988,2003.4
SLN,"Salina, KS: Salina Regional",713.0,132.0,459.32,0.18513323983169705,2003.4
SMF,"Sacramento, CA: Sacramento International",56417.0,10916.0,387.84,0.19348777850647855,2003.4
SMX,"Santa Maria, CA: Santa Maria Public/Capt. G. Allan Hancock Field",106.0,25.0,113.8,0.2358490566037736,2003.4
SNA,"Santa Ana, CA: John Wayne Airport-Orange County",44113.0,7636.0,430.95,0.1731008999614626,2003.4
SPI,"Springfield, IL: Abraham Lincoln Capital",765.0,160.0,238.17,0.20915032679738563,2003.4
SPN,"Saipan, TT: Francisco C. Ada Saipan International",366.0,10.0,612.12,0.0273224043715847,2003.4
SPS,"Wichita Falls, TX: Sheppard AFB/Wichita Falls Municipal",725.0,126.0,534.47,0.17379310344827587,2003.4
SRQ,"Sarasota/Bradenton, FL: Sarasota/Bradenton International",16299.0,3398.0,334.8,0.2084790477943432,2003.4
STC,"St. Cloud, MN: St. Cloud Regional",150.0,9.0,211.22,0.06,2003.4
STL,"St. Louis, MO: St Louis Lambert International",68408.0,12916.0,397.36,0.18880832651151913,2003.4
STS,"Santa Rosa, CA: Charles M. Schulz - Sonoma County",4350.0,895.0,306.18,0.2057471264367816,2003.4
STT,"Charlotte Amalie, VI: Cyril E King",5537.0,1108.0,373.06,0.20010836192884232,2003.4
STX,"Christiansted, VI: Henry E. Rohlsen",1196.0,306.0,366.63,0.25585284280936454,2003.4
SUN,"Sun Valley/Hailey/Ketchum, ID: Friedman Memorial",2297.0,297.0,643.84,0.12929908576404006,2003.4
SUX,"Sioux City, IA: Sioux Gateway Brig Gen Bud Day Field",730.0,171.0,497.55,0.23424657534246576,2003.4
SWF,"Newburgh/Poughkeepsie, NY: New York Stewart International",425.0,70.0,163.54,0.16470588235294117,2003.4
SWO,"Stillwater, OK: Stillwater Regional",730.0,112.0,524.09,0.15342465753424658,2003.4
SYR,"Syracuse, NY: Syracuse Hancock International",16470.0,3386.0,375.19,0.2055859137826351,2003.4
TLH,"Tallahassee, FL: Tallahassee International",6823.0,1236.0,554.31,0.18115198592994283,2003.4
TOL,"Toledo, OH: Eugene F Kranz Toledo Express",375.0,64.0,166.39,0.17066666666666666,2003.4
TPA,"Tampa, FL: Tampa International",78512.0,18310.0,330.3,0.2332127572855105,2003.4
TRI,"Bristol/Johnson City/Kingsport, TN: Tri Cities",4283.0,620.0,604.02,0.14475834695307027,2003.4
TTN,"Trenton, NJ: Trenton Mercer",1804.0,400.0,157.59,0.22172949002217296,2003.4
TUL,"Tulsa, OK: Tulsa International",19049.0,4002.0,436.69,0.21008976849178435,2003.4
TUS,"Tucson, AZ: Tucson International",19585.0,3950.0,447.17,0.20168496298187388,2003.4
TVC,"Traverse City, MI: Cherry Capital",5414.0,1132.0,501.7,0.20908755079423716,2003.4
TWF,"Twin Falls, ID: Joslin Field - Magic Valley Regional",700.0,63.0,758.8,0.09,2003.4
TXK,"Texarkana, AR: Texarkana Regional-Webb Field",737.0,167.0,570.15,0.2265943012211669,2003.4
TYR,"Tyler, TX: Tyler Pounds Regional",1090.0,200.0,606.36,0.1834862385321101,2003.4
TYS,"Knoxville, TN: McGhee Tyson",19869.0,4194.0,426.22,0.21108259097085913,2003.4
USA,"Concord, NC: Concord Padgett Regional",704.0,181.0,112.03,0.2571022727272727,2003.4
VCT,"Victoria, TX: Victoria Regional",635.0,105.0,525.58,0.16535433070866143,2003.4
VEL,"Vernal, UT: Vernal Regional",52.0,8.0,540.22,0.15384615384615385,2003.4
VLD,"Valdosta, GA: Valdosta Regional",781.0,119.0,677.86,0.1523687580025608,2003.4
VPS,"Valparaiso, FL: Eglin AFB Destin Fort Walton Beach",9898.0,2021.0,383.44,0.2041826631642756,2003.4
WRG,"Wrangell, AK: Wrangell Airport",726.0,121.0,528.71,0.16666666666666666,2003.4
WYS,"West Yellowstone, MT: Yellowstone",313.0,41.0,484.59,0.13099041533546327,2003.4
XNA,"Fayetteville, AR: Northwest Arkansas National",15286.0,2933.0,464.78,0.19187491822582756,2003.4
XWA,"Williston, ND: Williston Basin International",1973.0,362.0,595.08,0.183476938672073,2003.4
YAK,"Yakutat, AK: Yakutat Airport",726.0,130.0,550.91,0.1790633608815427,2003.4
YKM,"Yakima, WA: Yakima Air Terminal/McAllister Field",727.0,97.0,575.41,0.13342503438789546,2003.4
YUM,"Yuma, AZ: Yuma MCAS/Yuma International",1722.0,236.0,692.1,0.13704994192799072,2003.4
